{
  "schema_version": "CAPABILITY_COMPILATION_RESULT-v1",
  "evaluation_reference": "sha256:eval001",
  "proposal_reference": "sha256:prop001",
  "compilation_status": "COMPILED",
  "compilation_timestamp": "2026-08-20T10:00:00Z",
  "candidate_payload_reference": "sha256:candidate001",
  "failure_reason_class": null,
  "compiler_identity": "host-compiler-v1"
}
